### ISSUE TITLE
`remove_firewall_rule` with `remove_all: true` has no effect

### ISSUE THREAD

**Issue by CaptnOliv** [vithurshanselvarajah/ha-glinet-router#31]
### Router model

GL-MT3000

### Firmware version

4.8.1

### Integration version

1.4.0

### Home Assistant version

2026.5.2

### Home Assistant install type

Home Assistant Container (Docker)

### Description

Calling the `ha_glinet.remove_firewall_rule` service with `remove_all: true` does not remove any firewall rules. The rules added via `add_firewall_rule` remain present on the router after the call, and the `sensor.firewall_rules` count is unchanged.

### Steps to Reproduce

1. Add a firewall rule via `ha_glinet.add_firewall_rule`
2. Confirm the rule appears on the router (GL.iNet admin UI > Network > Firewall)
3. Call `ha_glinet.remove_firewall_rule` with `remove_all: true`
4. Observe that no rules are removed

### Expected Behavior

All custom firewall rules added via the integration should be removed.

### Actual Behavior

No rules are removed. The router and `sensor.firewall_rules` state are unchanged.

### Additional Context

Looking at the code in `hub.py`:

```python
async def remove_firewall_rule(self, rule_id: str | None = None, remove_all: bool = False) -> None:
    params = {}
    if remove_all:
        params["all"] = True
    elif rule_id:
        params["id"] = rule_id
    await self._invoke_api(lambda: self.router_api.firewall.remove_rule(params))
    await self.fetch_firewall_rules()
```

The `{"all": true}` payload is sent to `firewall.remove_rule` but the router does not seem to act on it. It is unclear whether this is a router API issue or a payload format issue.

Note: removal by `rule_id` cannot easily be tested either, as `add_firewall_rule` returns `None` and does not expose the created rule's ID. The `sensor.firewall_rules` entity only exposes a count, not the rule list or IDs.

**Comment by vithurshanselvarajah** [comment]
Hi @kitenoob 

I'll look at implementing a view firewall rules so you can collect the ID. 

I'll need to review the documentation for the all=true, leave that with me to investigate and i'll get back to you.

**Comment by vithurshanselvarajah** [comment]
I might look at implementing a "playground" so users can use an action to send any kind of request to the router. This would probably facilitate testing and custom actions better as well in future.

**Comment by vithurshanselvarajah** [comment]
I am waiting for documentation from GL-iNet before i proceed with the fix for this as this was created by reverse engineering originally. I should hopefully get it tomorrow.

**Comment by vithurshanselvarajah** [comment]
I'll be adding playground on the roadmap. It's definitely something i want, perhaps under a "developer" feature so i can test requests before they ever go into code. However, its a lot more complicated than anticipated so i'm de prioritising it.

**Comment by CaptnOliv** [comment]
Hi @vithurshanselvarajah, 

thanks for the quick fixes! However I'm still experiencing issues with `remove_firewall_rule` and wanted to share more details before this gets fully closed.

## What works ✅

`get_firewall_rules` works great and returns the following structure:
```yaml
rules:
  - id: cfg2992bd
    name: restricted_allow_iphone1
  - id: cfg2a92bd
    name: restricted_block_all
```

## What's broken ❌

Calling `remove_firewall_rule` with one of those IDs returns a 500 from the router:

```yaml
action: ha_glinet.remove_firewall_rule
data:
  rule_id: cfg2992bd
```

```
UnsuccessfulRequest: Request failed or returned invalid JSON (status 500):
<html><head><title>500 Internal Server Error</title></head>
<body><center><h1>500 Internal Server Error</h1></center>
<hr><center>nginx/1.26.1</center></body></html>
```

Full traceback:
```
Traceback (most recent call last):
  File "/config/custom_components/ha_glinet/api/client.py", line 53, in _extract_response_data
    payload = await response.json(content_type=None)
  File "/config/custom_components/ha_glinet/api/modules/firewall.py", line 25, in remove_rule
    return await self._call("firewall", "remove_rule", params)
  ...
custom_components.ha_glinet.api.exceptions.UnsuccessfulRequest: Request failed or returned invalid JSON (status 500)
```

**Comment by vithurshanselvarajah** [comment]
Just doing some additional tests on this. 

I will release a hotfix (i don't actually have a "hotfix" release mechanism. I think that would break hacs 😆)

Will try to get a fix out tonight.

**Comment by vithurshanselvarajah** [comment]
Interestingly. 

That works for me, i have tried a few variations. I'm not sure why it doesn't work for you. 

Can you capture the request and response when you manually add and remove a firewall rule from developer tools?

**Comment by vithurshanselvarajah** [comment]
It would help if you provide complete data (minus the sensitive stuff like token)

**Comment by CaptnOliv** [comment]
Hi, thanks again for looking into this!

I enabled debug logging and captured the sequence: add a rule → get_firewall_rules → remove_firewall_rule → get_firewall_rules again.

The rule was successfully added and appeared in get_firewall_rules with id `cfg2992bd`, but remove_firewall_rule returned a 500 and the rule remained.

Unfortunately the debug logs don't capture the raw HTTP payloads (request body / response), only the high-level hub operations. I don't see the actual JSON sent to the router or its response, so I can't provide the exact request/response you're looking for from the HA logs alone.

I suspect the issue might be related to **Network Acceleration being enabled** on my MT3000, which seems to disable or alter several API endpoints on the router side. This might explain why the same call works for you but returns a 500 for me.

Would it help if I ran a `tcpdump` on the router to capture the raw HTTP traffic during the add/remove sequence? Or is there another way you'd suggest to capture the payloads?

Happy to test anything you need.

Thanks!

**Comment by vithurshanselvarajah** [comment]
Hi @kitenoob 

Apologies. I meant capture the requests directly on the router management page. 

If you go to the correct section. Enable your browsers developer tools. It should have a network tab that will let you record requests and responses that the page makes. 

Heres a quick example for chrome https://developer.chrome.com/docs/devtools/network

**Comment by vithurshanselvarajah** [comment]
Hi @kitenoob 

Just wanted to check in to see if you have had a chance to try the above?

**Comment by CaptnOliv** [comment]
Hi 

Not yet, but I will definitely try asap 😅
Sorry for the delay

**Comment by CaptnOliv** [comment]
Hi @vithurshanselvarajah 

here are the result

<code>
Host: 192.168.8.1
User-Agent: HomeAssistant/2026.5.2 aiohttp/3.13.5 Python/3.14
Accept: */*
Accept-Encoding: gzip, deflate, br
Content-Length: 116
Content-Type: application/json

{"method":"call","jsonrpc":"2.0","params":["KJ7D4gI6KuBj7DQmCOm6BcBgBkIgiJCB","firewall","get_rule_list",{}],"id":0}
08:21:15.957551 IP _gateway.http > JazzyPI.35312: Flags [.], ack 323, win 1014, options [nop,nop,TS val 1493367922 ecr 1432539229], length 0
E..4.V@.@..e.........P..X..+`.......1......
Y..rUb.]
08:21:15.960739 IP _gateway.http > JazzyPI.35312: Flags [P.], seq 1:424, ack 323, win 1014, options [nop,nop,TS val 1493367926 ecr 1432539229], length 423: HTTP: HTTP/1.1 200 OK
E....W@.@............P..X..+`..............
Y..vUb.]HTTP/1.1 200 OK
Server: nginx/1.26.1
Date: Sat, 13 Jun 2026 06:21:15 GMT
Content-Type: application/octet-stream
Transfer-Encoding: chunked
Connection: keep-alive
Content-Type: application/json
X-Frame-Options: DENY

bb
{"id":0,"jsonrpc":"2.0","result":{"res":[{"enabled":true,"id":"cfg2c92bd","proto":"tcpudp","src":"lan","name":"test rule","target":"ACCEPT","dest":"wan","src_mac":"5C:3E:1B:23:31:A1"}]}}



Host: 192.168.8.1
User-Agent: HomeAssistant/2026.5.2 aiohttp/3.13.5 Python/3.14
Accept: */*
Accept-Encoding: gzip, deflate, br
Content-Length: 130
Content-Type: application/json

{"method":"call","jsonrpc":"2.0","params":["c4vLFOfRkKhYOMIyrFUEqe309Q42zPd4","firewall","remove_rule",{"id":"cfg2c92bd"}],"id":0}
08:22:12.490217 IP _gateway.http > JazzyPI.56118: Flags [.], ack 337, win 1013, options [nop,nop,TS val 1493424455 ecr 1432595762], length 0
E..4.O@.@..k.........P.6.Y.#?6.I....dZ.....
Y..GUc.2
08:22:12.493180 IP _gateway.http > JazzyPI.56118: Flags [P.], seq 1:340, ack 337, win 1013, options [nop,nop,TS val 1493424458 ecr 1432595762], length 339: HTTP: HTTP/1.1 500 Internal Server Error
E....P@.@............P.6.Y.#?6.I.....H.....
Y..JUc.2HTTP/1.1 500 Internal Server Error
Server: nginx/1.26.1
Date: Sat, 13 Jun 2026 06:22:12 GMT
Content-Type: text/html
Content-Length: 177
Connection: close

<html>
<head><title>500 Internal Server Error</title></head>
<body>
<center><h1>500 Internal Server Error</h1></center>
<hr><center>nginx/1.26.1</center>
</body>
</html>


</code>

**Comment by vithurshanselvarajah** [comment]
Hi @kitenoob,

Thanks for sending this. This looks like it captures the request from home assistant to the router.

I need to see what a successful request also looks like on your router so I can determine how it's behaving differently compared to what the API docs say.

Can you perform the same by adding and deleting a rule on the router itself and capturing both network requests your browser makes using developer tools? 

Once you find the correct request within the network tab. It should let you right click on it and copy it in curl format. 

Once I have this I can identify what your router is expecting and why my implementation is working for some but not others.

**Comment by CaptnOliv** [comment]
i think I got it 😅

<code>
curl 'http://192.168.8.1:8080/ubus/?1781422283338' \
  -H 'Accept: */*' \
  -H 'Accept-Language: fr-FR,fr;q=0.9,en;q=0.8,en-GB;q=0.7,en-US;q=0.6' \
  -H 'Cache-Control: no-cache' \
  -H 'Connection: keep-alive' \
  -H 'Content-Type: application/json' \
  -b 'Admin-Token=' \
  -H 'Origin: http://192.168.8.1:8080' \
  -H 'Pragma: no-cache' \
  -H 'Referer: http://192.168.8.1:8080/cgi-bin/luci/admin/network/firewall/rules' \
  -H 'User-Agent: Mozilla/5.0 (Macintosh; Intel Mac OS X 10_15_7) AppleWebKit/537.36 (KHTML, like Gecko) Chrome/147.0.0.0 Safari/537.36 Edg/147.0.0.0' \
  --data-raw '[{"jsonrpc":"2.0","id":21,"method":"call","params":["afca24c656d3d4c539e1d72688e7c743","uci","add",{"config":"firewall","type":"rule","values":{"name":"test","src":"lan","src_ip":["192.168.8.124"],"dest":"wan","target":"ACCEPT"}}]}]' \
  --insecure



curl 'http://192.168.8.1:8080/ubus/?1781422469299' \
  -H 'Accept: */*' \
  -H 'Accept-Language: fr-FR,fr;q=0.9,en;q=0.8,en-GB;q=0.7,en-US;q=0.6' \
  -H 'Cache-Control: no-cache' \
  -H 'Connection: keep-alive' \
  -H 'Content-Type: application/json' \
  -b 'Admin-Token=' \
  -H 'Origin: http://192.168.8.1:8080' \
  -H 'Pragma: no-cache' \
  -H 'Referer: http://192.168.8.1:8080/cgi-bin/luci/admin/network/firewall/rules' \
  -H 'User-Agent: Mozilla/5.0 (Macintosh; Intel Mac OS X 10_15_7) AppleWebKit/537.36 (KHTML, like Gecko) Chrome/147.0.0.0 Safari/537.36 Edg/147.0.0.0' \
  --data-raw '[{"jsonrpc":"2.0","id":26,"method":"call","params":["afca24c656d3d4c539e1d72688e7c743","uci","delete",{"config":"firewall","section":"cfg2d92bd","options":null}]},{"jsonrpc":"2.0","id":27,"method":"call","params":["afca24c656d3d4c539e1d72688e7c743","uci","delete",{"config":"firewall","section":"lan_drop_leaked_dns","options":["enabled"]}]},{"jsonrpc":"2.0","id":28,"method":"call","params":["afca24c656d3d4c539e1d72688e7c743","uci","delete",{"config":"firewall","section":"wgserver_drop_leaked_dns","options":["enabled"]}]},{"jsonrpc":"2.0","id":29,"method":"call","params":["afca24c656d3d4c539e1d72688e7c743","uci","delete",{"config":"firewall","section":"ovpnserver_drop_leaked_dns","options":["enabled"]}]},{"jsonrpc":"2.0","id":30,"method":"call","params":["afca24c656d3d4c539e1d72688e7c743","uci","delete",{"config":"firewall","section":"cfg2c92bd","options":["enabled"]}]},{"jsonrpc":"2.0","id":31,"method":"call","params":["afca24c656d3d4c539e1d72688e7c743","uci","set",{"config":"firewall","section":"wan_drop_leaked_dns","values":{"enabled":"0"}}]},{"jsonrpc":"2.0","id":32,"method":"call","params":["afca24c656d3d4c539e1d72688e7c743","uci","set",{"config":"firewall","section":"guest_drop_leaked_dns","values":{"enabled":"0"}}]},{"jsonrpc":"2.0","id":33,"method":"call","params":["afca24c656d3d4c539e1d72688e7c743","uci","set",{"config":"firewall","section":"cfg0f92bd","values":{"enabled":"0"}}]}]' \
  --insecure

</code>

**Comment by vithurshanselvarajah** [comment]
Hi @kitenoob 

This is very interesting. 

It looks like the requests are being made via ubus which is normally done via luci. GL.iNet's stock firmware normally wouldn't touch this and ubus isn't even listed as being supported on their documentation.

Do you have luci enabled and is this what you are using on your router? 

Depending on where in the world you are. It may be easier to have a look at this over a screenshare via discord.

**Comment by CaptnOliv** [comment]
Yes Luci is enabled, and I use it to manage fw rules.
I'm UTC+3, and you can find me as kitenoob on discord 😉

**Comment by vithurshanselvarajah** [comment]
Just sent a request to connect. 

I’m in London so we might need to find a time that suits the both of us!
